공종명,공종코드,대분류,중분류,태그,내용,중요표기
방수공사,3070,방수공사,공사사항,공통,공정상 동절기 공사가 있을 예정으로 기후에 따른 생산성 저하 및 작업중단 등을 감안하여 입찰하여야 한다.,
방수공사,3070,방수공사,공사사항,공통,"방수공사시 각종 방수재에 의한 타공종, 공사부위, 자재의 오염을 방지해야 하며 “수급사업자”의 귀책으로 인한 방수재 오염시 “수급사업자”의 부담으로 제거한다.",
방수공사,3070,방수공사,공사사항,공통,담수시험에 따른 타공정 피해 발생시 해당 보수 및 복구비용은 “수급사업자”가 부담한다.,
방수공사,3070,방수공사,공사사항,공통,현장 내 자재는 2일을 초과하여 야적해서는 안 된다.,
방수공사,3070,방수공사,공사사항,공통,공종별견적조건(공통)의 “3. 공사사항 7) “의 조항에서 APT 담수시험은 각 동 3개층 단위로 시행한다.,중요
방수공사,3070,방수공사,공사사항,공통,"시공에 필요한 가설발판 등 포함하여 견적한다. 지하 외벽 방수의 경우, 당 현장은 갱폼 사용하여, 별도의 외부비계가 없으므로 이를 감안하여 견적한다.",
방수공사,3070,방수공사,공사사항,공용부,"트랜치 내부방수는 A81-003 도면을 참조하며, 방수에 사용되는 레미탈 등 자재는 포함하여 견적한다.",
방수공사,3070,방수공사,공사사항,공용부,Roof Drain 주변방수는 공종별견적조건 4. 공사세부사항 -지붕방수 내용 중 11항 을 따른다.,
방수공사,3070,방수공사,공사사항,공용부,"바닥 드레인 파취 후 방수 마감 시, 보양 미흡으로 최종 코킹에 황변 발생 시 “수급사업자”에서 재시공하여야 한다.",
방수공사,3070,방수공사,공사사항,세대,"세대 자재인양구 부위는 방수 작업시 요철이 발생되지 않도록 바탕면의 평활도를 확보하고, 타설부위와 단차가 발생하지 않도록 도막방수 전 충분한 바탕면의 시공품질을 확보해야 한다.",
방수공사,3070,방수공사,공사사항,세대,세대 욕실/발코니 방수 시 분합문틀 하부 및 피난사다리 등은 “수급사업자”가 오염방지 보양조치하고 바닥방수 및 벽체 감아올림 방수를 실시하여야 한다.,
방수공사,3070,방수공사,공사사항,세대,다용도실 단열재 하부 2회 방수 투입을 감안하여 견적한다.,
방수공사,3070,방수공사,공사사항,옥상,아파트 옥상 및 옥탑 폴리우레아 방수 기준 ... (세부 항목 전체 문구),중요
방수공사,3070,방수공사,공사사항,옥상,ABS방수보호제 내역은 옥상 단면도의 바닥방수를 벽체 감아올림한 부분을 보호하는 보호 벽돌을 대체하는 내용이며 도면에 미반영 되어있으므로 내역서 기준으로 견적한다.,
방수공사,3070,방수공사,공사사항,주차장,"당 현장 일부 주차장 슬라브는 데크 및 PC구조로써 누수 발생 시 하자보수가 어려운 점을 감안하여 상부 도막방수 시 하자가 없도록 바탕면처리, 재료 및 시공법, 바름량 및 품질관리에 만전을 기하여야 한다.",
방수공사,3070,방수공사,공사사항,주차장,"흙에 면한 지하주차장 외벽 국부방수의 공사부위는 외벽 중 흙에 접하는 부위의 핀자리, 갱폼 홈부위, 이어치기 등 부위이며, 되메우기 일정에 따라 분할하여 투입하여야 한다.",
방수공사,3070,방수공사,공사사항,주차장,건물 외벽으로 관통되는 각종 슬리브 주위 방수를 포함한다. (국부방수 내역에 해당),
방수공사,3070,방수공사,공사사항,주차장,"3. 공사사항 17)의 추가사항 : 주차장 등 치켜올림 부위 방수보호재 시공시 탈락되는 하자가 많으므로, 고정용 철물 등을 사용하여 고정하며 탈락된 보호재는 즉시 보수하여야 한다.",중요
방수공사,3070,방수공사,안전사항,공통,"작업 근로자는 반드시 배치 전 건강진단 결과를 지참하여 신규교육을 이수할 수 있도록 하고, 작업 시 “원사업자”와 연결된 주파수 무전기를 지참하여야 한다.",
방수공사,3070,방수공사,안전사항,시공,"에폭시 등 작업 시, 주변 화기작업이 진행되지 않도록 공정회의 참석하여 타 협력사와 작업사항을 조율하도록 하며 작업팀은 라이터 수거함을 별도로 만들어 작업 전 수거를 실시한다.",
방수공사,3070,방수공사,안전사항,시공,"밀폐부위 방수작업 시(우수 저수조 등) 2인 1조 작업을 원칙으로 하며, 작업 전 “원사업자”의 승인을 득한 후에 실시한다.",
방수공사,3070,방수공사,안전사항,자재,"에폭시 등 유기용제 사용 작업 시 반드시 작업 구간에 면적량에 맞는 배풍기(환풍기)와 후렉시블덕트(자바라) 준비, 적정 보호구(방독마스크, 필터, 장갑, 보안경)를 착용하고 작업한다.",
방수공사,3070,방수공사,안전사항,자재,작업일에 사용 완료된 유해물질은 반드시 그날 반출 조치한다. (공병 현장 적치 금지),
방수공사,3070,방수공사,안전사항,자재,위험물저장소를 반입하며 유해물질은 외부 적치가 아닌 위험물 저장소에 보관하도록 한다.,중요
방수공사,3070,방수공사,안전사항,자재,유해물질 반입 전 해당 물질에 관련된 MSDS 전문 최신 개정본을 안전팀에 사전 제출한다.,
